<?xml version="1.0" encoding="UTF-8"?>
<xs:schema xmlns:xs="http://www.w3.org/2001/XMLSchema" elementFormDefault="qualified">
  <xs:element name="condition-types">
    <xs:complexType>
      <xs:sequence>
        <xs:element ref="condition-type" maxOccurs="unbounded"/>
      </xs:sequence>
    </xs:complexType>
  </xs:element>
  <xs:element name="condition-type">
    <xs:complexType>
      <xs:sequence>
        <xs:element ref="args"/>
        <xs:element name="code" type="xs:string"/>
      </xs:sequence>
      <xs:attribute name="id" type="xs:string" use="required"/>
    </xs:complexType>
  </xs:element>
  <xs:element name="args">
    <xs:complexType>
      <xs:sequence>
        <xs:element ref="arg" maxOccurs="unbounded"/>
      </xs:sequence>
    </xs:complexType>
  </xs:element>
  <xs:element name="arg">
    <xs:complexType>
      <xs:attribute name="id" type="xs:string" use="required"/>
      <xs:attribute name="type" type="xs:string" use="required"/>
    </xs:complexType>
  </xs:element>
</xs:schema>
